N;CODIGO UNIFICADO;REGION;NOMBRE DEL PROYECTO;UNIDAD EJECUTORA;COSTO DEL PROYECTO;BENEFICIARIOS;NÚMERO DE PUESTOS DE TRABAJO GENERADOS;;;
1;2343153;AMAZONAS;CREACION Y MEJORAMIENTO DEL SISTEMA DE AGUA POTABLE Y SANEAMIENTO DE LAS LOCALIDADES DE CHONTAPAMPA, MARYPAMAPA, CUCHAPAMPA Y PALACHE, DISTRITO DE QUINJALCA - CHACHAPOYAS - AMAZONAS;MUNICIPALIDAD DISTRITAL DE QUINJALCA;7,772,907.74;1,371;87;;;
2;2271356;AMAZONAS;MEJORAMIENTO, AMPLIACION DE LOS SERVICIOS DE AGUA POTABLE , ALCANTARILLADO DE LA LOCALIDAD DE SAN BARTOLO, DISTRITO DE SANTO TOMAS - LUYA - AMAZONAS;MUNICIPALIDAD DISTRITAL DE SANTO TOMAS;3,154,644.76;368;71;;;
3;2303043;AMAZONAS;MEJORAMIENTO Y AMPLIACION DEL SISTEMA DE AGUA POTABLE Y SANEAMIENTO BASICO DE LOS CASERIOS BUENOS AIRES Y PORVENIR, DISTRITO DE CUMBA - UTCUBAMBA - AMAZONAS;MUNICIPALIDAD DISTRITAL DE CUMBA;2,974,326.79;450;49;;;
4;2290235;AMAZONAS;MEJORAMIENTO DE LA CAPTACION Y LINEA DE CONDUCCION DEL AGUA POTABLE DE LA LOCALIDAD DE TRITA, DISTRITO DE TRITA - LUYA - AMAZONAS;MUNICIPALIDAD PROVINCIAL DE LUYA - LAMUD;2,953,699.60;1,062;57;;;
5;2235656;AMAZONAS;AMPLIACION Y MEJORAMIENTO DEL SERVICIO DE AGUA POTABLE Y SANEAMIENTO EN EL CENTRO POBLADO HEBRON, DISTRITO DE NIEVA, PROVINCIA DE CONDORCANQUI - AMAZONAS;PROGRAMA NACIONAL DE SANEAMIENTO RURAL;1,990,482.99;248;31;;;
6;2266065;AMAZONAS;MEJORAMIENTO Y AMPLIACION DEL SERVICIO DE AGUA POTABLE E INSTALACION DEL SERVICIO DE SANEAMIENTO EN EL CENTRO POBLADO SELVA VERDE, DISTRITO DE ARAMANGO - BAGUA - AMAZONAS;PROGRAMA NACIONAL DE SANEAMIENTO RURAL;1,591,537.53;117;35;;;
7;2254001;AMAZONAS;MEJORAMIENTO Y AMPLIACIÓN DEL SERVICIO DE AGUA POTABLE E INSTALACIÓN DEL SERVICIO DE SANEAMIENTO EN EL CENTRO POBLADO DUELAC, DISTRITO DE JAMALCA- UTCUBAMBA- AMAZONAS;PROGRAMA NACIONAL DE SANEAMIENTO RURAL;2,232,366.11;214;44;;;
8;2286781;AMAZONAS;MEJORAMIENTO Y AMPLIACIÓN DEL SERVICIO DE AGUA POTABLE E INSTALACIÓN DEL SERVICIO DE SANEAMIENTO EN EL CENTRO POBLADO EL TRIUNFO, DISTRITO DE LA PECA- BAGUA-AMAZONAS;PROGRAMA NACIONAL DE SANEAMIENTO RURAL;2,512,458.69;275;50;;;
9;2200393;AMAZONAS;MEJORAMIENTO Y AMPLIACION DEL SERVICIO DE AGUA POTABLE E INSTALACION DEL SERVICIO DE SANEAMIENTO EN EL CENTRO POBLADO PERLA DEL IMAZA , DISTRITO DE YAMBRASBAMBA - BONGARA - AMAZONAS;PROGRAMA NACIONAL DE SANEAMIENTO RURAL;2,559,045.31;345;42;;;
10;2235897;AMAZONAS;INSTALACION DE LOS SERVICIO DE AGUA POTABLE Y DISPOSICION SANITARIAS DE EXCRETAS Y DE AGUAS GRISES EN LA COMUNIDAD DE NATIVA DE UUT, DISTRITO DE IMAZA, PROVINCIA DE BAGUA, DEPARTAMENTO DE AMAZONAS;PROGRAMA NACIONAL DE SANEAMIENTO RURAL;4,170,965;408;66;;;
11;2235419;AMAZONAS;MEJORAMIENTO Y AMPLIACION DEL SERVICIO DE AGUA POTABLE E INSTALACIÓN DE LA DISPOSICIÓN SANITARIA DE EXCRETAS Y DE AGUAS GRISES EN LA COMUNIDAD NATIVA DE WAWAIM, DISTRITO DE IMAZA, PROVINCIA DE BAGUA, DEPARTAMENTO DE AMAZONAS;PROGRAMA NACIONAL DE SANEAMIENTO RURAL;4,725,585;398;89;;;
12;2427596;AMAZONAS;"ADQUISICIÓN DE LÍNEA DE ADUCCIÓN; EN EL(LA) EMPRESA MUNICIPAL DE AGUA POTABLE Y ALCANTARILLADO DE BAGUA DISTRITO DE BAGUA, PROVINCIA BAGUA, DEPARTAMENTO AMAZONAS";EMPRESA MUNICIPAL DE AGUA POTABLE Y ALCANTARILLADO DE BAGUA S.A.;201608.61;27,102;10;;;
13;2427595;AMAZONAS;"ADQUISICIÓN DE BOMBAS DOSIFICADORAS; EN EL(LA) EMPRESA MUNICIPAL DE AGUA POTABLE Y ALCANTARILLADO DE BAGUA DISTRITO DE BAGUA, PROVINCIA BAGUA, DEPARTAMENTO AMAZONAS";EMPRESA MUNICIPAL DE AGUA POTABLE Y ALCANTARILLADO DE BAGUA S.A.;460107.01;27,102;5;;;
14;2427543;AMAZONAS;"ADQUISICIÓN DE MACROMEDIDORES; EN EL(LA) EMPRESA MUNICIPAL DE AGUA POTABLE Y ALCANTARILLADO DE BAGUA DISTRITO DE BAGUA, PROVINCIA BAGUA, DEPARTAMENTO AMAZONAS";EMPRESA MUNICIPAL DE AGUA POTABLE Y ALCANTARILLADO DE BAGUA S.A.;154834.66;27,102;5;;;
15;2429984;AMAZONAS;CREACION DE LA LOSA DE RECREACION MULTIUSO EN LA LOCALIDAD DE EL PARCO DEL DISTRITO DE EL PARCO - PROVINCIA DE BAGUA - DEPARTAMENTO DE AMAZONAS;MUNICIPALIDAD DISTRITAL DE EL PARCO;611,459;1,485;19;;;
16;2471724;AMAZONAS;CREACION DE PARQUE JARDIN SECTOR SAN LUIS BAJO DEL DISTRITO DE BAGUA GRANDE - PROVINCIA DE UTCUBAMBA - DEPARTAMENTO DE AMAZONAS;MUNICIPALIDAD PROVINCIAL DE UTCUBAMBA - BAGUA GRANDE;562,682;2,019;17;;;
17;2422609;AMAZONAS;CREACION DEL PARQUE DE LA AMISTAD EN LA LOCALIDAD DE HUAMBO - DISTRITO DE HUAMBO - PROVINCIA DE RODRIGUEZ DE MENDOZA - DEPARTAMENTO DE AMAZONAS;MUNICIPALIDAD DISTRITAL DE HUAMBO;234,594;1,010;8;;;
18;2422608;AMAZONAS;CREACION DE LA LOZA DE RECREACIÓN MULTIUSOS EN LA LOCALIDAD DE HUAMBO - DISTRITO DE HUAMBO - PROVINCIA DE RODRIGUEZ DE MENDOZA - DEPARTAMENTO DE AMAZONAS;MUNICIPALIDAD DISTRITAL DE HUAMBO;425,070;1,010;14;;;
19;2449098;AMAZONAS;CREACION DE LOSA DE RECREACIÓN MULTIUSOS EN LA LOCALIDAD DE LIMABAMBA DEL DISTRITO DE LIMABAMBA - PROVINCIA DE RODRIGUEZ DE MENDOZA - DEPARTAMENTO DE AMAZONAS;MUNICIPALIDAD DISTRITAL DE LIMABAMBA;542,281;1,221;17;;;
20;2492192;AMAZONAS;"RENOVACION DE PAVIMENTO, PONTON Y OBRAS EXTERIORES; EN EL(LA) SERVICIO DE TRANSITABILIDAD DE VÍAS URBANAS DEL JR. INDEPENDENCIA, JR. LA UNIÓN, JR. FLORIDA Y JR. SAN MARTÍN DE LA LOCALIDAD DE POMACOCHAS, DISTRITO DE FLORIDA, PROVINCIA BONGARA, DEPARTAMENTO AMAZONAS";MUNICIPALIDAD DISTRITAL DE FLORIDA;832,300;468;25;;;
21;2492140;AMAZONAS;"CONSTRUCCION DE PAVIMENTO, SARDINEL, VEREDA Y CUNETA; ADEMÁS DE OTROS ACTIVOS EN EL(LA) EN EL BARRIO DE LUYA EN LA LOCALIDAD LUYA, DISTRITO DE LUYA, PROVINCIA LUYA, DEPARTAMENTO AMAZONAS";MUNICIPALIDAD DISTRITAL DE LUYA;1,741,568;1,320;52;;;
22;2492217;AMAZONAS;"RENOVACION DE PAVIMENTO, VEREDA Y DRENAJE LONGITUDINAL; CONSTRUCCION DE PUENTE PEATONAL; EN EL(LA) JR. BLÁS VALERA CDRAS. 03, 04 Y 05 DEL BARRIO SANTA ANA EN LA LOCALIDAD LAMUD, DISTRITO DE LAMUD, PROVINCIA LUYA, DEPARTAMENTO AMAZONAS";MUNICIPALIDAD PROVINCIAL DE LUYA;1,117,684;485;34;;;
23;2492209;AMAZONAS;"CONSTRUCCION DE PAVIMENTO, SARDINEL, VEREDA Y CUNETA; ADEMÁS DE OTROS ACTIVOS EN EL(LA) BARRIO MATRIZ EN LA LOCALIDAD LAMUD, DISTRITO DE LAMUD, PROVINCIA LUYA, DEPARTAMENTO AMAZONAS";MUNICIPALIDAD PROVINCIAL DE LUYA;1,115,641;485;34;;;
24;2207165;AMAZONAS;CREACION DEL PARQUE PRINCIPAL DEL ANEXO DE DIOSAN DIOSAN - DISTRITO DE GRANADA - PROVINCIA DE CHACHAPOYAS - DEPARTAMENTO DE AMAZONAS;MUNICIPALIDAD DISTRITAL DE GRANADA;267,973;2,229;9;;;
25;2493071;AMAZONAS;"CONSTRUCCION DE PAVIMENTO, VEREDA Y CUNETA; REPARACION DE ALCANTARILLA; ADEMÁS DE OTROS ACTIVOS EN EL(LA) SECTOR SANTA ROSA EN LA LOCALIDAD LA PECA, DISTRITO DE LA PECA, PROVINCIA BAGUA, DEPARTAMENTO AMAZONAS";MUNICIPALIDAD DISTRITAL DE LA PECA;696,235;80;21;;;
26;2252526;ANCASH;MEJORAMIENTO Y AMPLIACION DE LOS SERVICIOS DE AGUA POTABLE Y DISPOSICION SANITARIA DE EXCRETAS DE LA COMUNIDAD DE CHUCLLUSH , DISTRITO DE LLUMPA - MARISCAL LUZURIAGA - ANCASH;PROGRAMA NACIONAL DE SANEAMIENTO RURAL;2,208,248.38;310;35;;;
27;2280492;ANCASH;MEJORAMIENTO Y AMPLIACIÓN DE LOS SERVICIOS DE SANEAMIENTO BÁSICO EN EL CENTRO POBLADO DE HUAYPAN Y CASERÍOS DE PACCHA, PUTACA, CUNTARA, ACRAYPAMPA, PALTAC Y PACARI, DISTRITO DE MANCOS - YUNGAY - ANCASH;MUNICIPALIDAD DISTRITAL DE MANCOS;14,406,031.16;2,480;191;;;
28;2290904;ANCASH;AMPLIACION Y MEJORAMIENTO DEL SISTEMA DE AGUA POTABLE Y ALCANTARILLADO DEL CASERIO DE ANCORACA, DISTRITO DE MATO - HUAYLAS - ANCASH;MUNICIPALIDAD DISTRITAL DE MATO;2,842,115.78;455;66;;;
29;2334302;ANCASH;MEJORAMIENTO Y AMPLIACION DEL SERVICIO DE AGUA POTABLE Y SANEAMIENTO BASICO DE LAS LOCALIDADES DE ORATORIA, PAMPAMARCA, CACHUS, PIA CORRAL DEL CASERIO DE PONCOS , DISTRITO DE SHUPLUY, PROVINCIA DE YUNGAY - ANCASH;MUNICIPALIDAD DISTRITAL DE SHUPLUY;7,710,613.51;905;113;;;
30;2287704;ANCASH;INSTALACION DEL SISTEMA DE SANEAMIENTO BASICO DEL CC.PP DE CHINCHOBAMBA, DISTRITO DE SAN JUAN - SIHUAS - ANCASH;MUNICIPALIDAD DISTRITAL DE SAN JUAN;3,382,572.83;718;65;;;
31;2294975;ANCASH;INSTALACION DEL SERVICIO DE SANEAMIENTO BASICO RURAL Y AGUA POTABLE EN LOS CASERIOS DE AYAVIÑA Y HUANZA, DISTRITO DE RAGASH - SIHUAS - ANCASH;MUNICIPALIDAD DISTRITAL DE RAGASH;2,426,546.69;550;71;;;
32;2397326;ANCASH;MEJORAMIENTO Y AMPLIACION DEL  SERVICIO DE AGUA POTABLE Y SANEAMIENTO EN CENTRO POBLADO DE HIJIN - DISTRITO DE RAPAYAN - PROVINCIA DE HUARI - REGIÓN ANCASH;MUNICIPALIDAD DISTRITAL DE RAPAYAN;1,355,409.41;110;38;;;
33;2282548;ANCASH;CREACION DEL SERVICIO DE SANEAMIENTO RURAL EN LAS LOCALIDADES DE HUASCAR, CARAP, CAPAN, CAJAY, CARACHUCO,  SAN JUAN, Y WITCU, DISTRITO DE PAMPAROMAS - HUAYLAS - ANCASH;MUNICIPALIDAD DISTRITAL DE PAMPAROMAS;7,250,731.51;2,095;142;;;
34;2318916;ANCASH;INSTALACION Y MEJORAMIENTO DEL SISTEMA DE AGUA POTABLE Y SANEAMIENTO BÁSICO EN LOS CASERÍOS DE COLCABAMBA, SAN JOSE Y PAROBAMBA CHICO, DISTRITO DE HUAYLLABAMBA - SIHUAS - ANCASH;MUNICIPALIDAD DISTRITAL DE HUAYLLABAMBA;7,298,726.20;1,095;141;;;
35;2275644;ANCASH;MEJORAMIENTO Y AMPLIACION SISTEMA DE AGUA POTABLE Y DESAGÜE CON BIODIGESTOR EN LOS CASERIOS DE CAPACHA, SHONGUARCO, TARABAMBA, HUAYLLAMPO BAJO, PAUCA, DOS DE MAYO, NUEVO PROGRESO, HUARAULLAPAMPA Y CHOQUEBAMBA  DISTRITO DE CASHAPAMPA - PROVINCIA DE SIHUAS - DEPARTAMENTO DE ANCASH;MUNICIPALIDAD DISTRITAL DE CASHAPAMPA;10,141,828.81;1,131;116;;;
36;2342435;ANCASH;CREACION DEL SERVICIO DE SANEAMIENTO RURAL DE LAS LOCALIDADES DE ANCA, CHURAP, CUYHUAN, PACKAR E ICHOCA, DISTRITO DE MARCA - RECUAY - ANCASH;MUNICIPALIDAD DISTRITAL DE MARCA;8,365,746.31;1,172;117;;;
37;2294977;ANCASH;MEJORAMIENTO DEL SERVICIO DE SANEAMIENTO RURAL Y AGUA POTABLE EN LAS LOCALIDADES DE PAICARAN -TUCUSH, DISTRITO DE RAGASH - SIHUAS - ANCASH;MUNICIPALIDAD DISTRITAL DE RAGASH;2,975,622.92;640;70;;;
38;2280959;ANCASH;MEJORAMIENTO Y AMPLIACION DEL SISTEMA DEL SERVICIO DE AGUA POTABLE Y ALCANTARILLADO DEL CENTRO POBLADO HUACHO, DISTRITO DE QUILLO - YUNGAY - ANCASH;MUNICIPALIDAD DISTRITAL DE QUILLO;4,068,611;1,500;78;;;
39;2331675;ANCASH;MEJORAMIENTO, AMPLIACION DEL SISTEMA DE SANEAMIENTO BASICO DEL CENTRO POBLADO DE OCOCOCHA Y LAS LOCALIDADES DE LA MERCED Y QUINHUAY, DISTRITO DE HUACACHI - HUARI - ANCASH;MUNICIPALIDAD DISTRITAL DE HUACACHI;7,042,408;1,342;121;;;
40;2408895;ANCASH;"RENOVACIÓN DE VIAS URBANAS; EN EL(LA) TRAMO 1-1823 CALLE LIMA DESDE LA AV. REYNA HASTA LA CALLE COLON  DISTRITO DE CASMA, PROVINCIA CASMA, DEPARTAMENTO ANCASH";MUNICIPALIDAD PROVINCIAL DE CASMA;751,783;285;23;;;
41;2408836;ANCASH;"RENOVACIÓN DE VIAS URBANAS; EN EL(LA) TRAMO 1-1786 - AV. GAMARRA DESDE LA AV. LIBERTAD HASTA LA AV. NEPEÑA ,  DISTRITO DE CASMA, PROVINCIA CASMA, DEPARTAMENTO ANCASH";MUNICIPALIDAD PROVINCIAL DE CASMA;678,708;285;20;;;
42;2408839;ANCASH;"RENOVACIÓN DE VIAS URBANAS; EN EL(LA) TRAMO 1-1794 - AV. PERU DESDE LA AV. RESERVORIO HASTA LA AV. CESAR VALLEJO  DISTRITO DE CASMA, PROVINCIA CASMA, DEPARTAMENTO ANCASH";MUNICIPALIDAD PROVINCIAL DE CASMA;626,599;285;19;;;
43;2258909;ANCASH;MEJORAMIENTO DE LOS SERVICIOS DE TRANSITABILIDAD PEATONAL Y VEHICULAR EN LA CALLE PRINCIPAL DEL SECTOR FUNDO ACO, DISTRITO DE SAN MIGUEL DE ACO - CARHUAZ - ANCASH;MUNICIPALIDAD DISTRITAL DE SAN MIGUEL DE ACO;2,264,057;2,722;67;;;
44;2492034;ANCASH;"REPARACION DE PISTA Y VEREDA; EN EL(LA) SECTOR COISHCO VIEJO DISTRITO DE COISHCO, PROVINCIA SANTA, DEPARTAMENTO ANCASH";MUNICIPALIDAD DISTRITAL DE COISHCO;879,364;828;26;;;
45;2492038;ANCASH;"REPARACION DE PISTA Y VEREDA; EN EL(LA) JIRÓN FRANCISCO BOLOGNESI DISTRITO DE COISHCO, PROVINCIA SANTA, DEPARTAMENTO ANCASH";MUNICIPALIDAD DISTRITAL DE COISHCO;651,360;720;20;;;
46;2492311;ANCASH;"CONSTRUCCION DE CALZADA, VEREDA Y SARDINEL; REPARACION DE CALZADA; ADEMÁS DE OTROS ACTIVOS EN EL(LA) CENTRO POBLADO MACATE EN LA LOCALIDAD MACATE, DISTRITO DE MACATE, PROVINCIA SANTA, DEPARTAMENTO ANCASH";MUNICIPALIDAD DISTRITAL DE MACATE;650,854;313;20;;;
47;2492435;ANCASH;"CONSTRUCCION DE CALZADA, VEREDA, CUNETA Y RAMPA; ADEMÁS DE OTROS ACTIVOS EN EL(LA) ÁMBITO URBANO DE LA LOCALIDAD DE MASIN  DISTRITO DE MASIN, PROVINCIA HUARI, DEPARTAMENTO ANCASH";MUNICIPALIDAD DISTRITAL DE MASIN;555,135;83;17;;;
48;2492331;ANCASH;"REPARACION DE CALZADA Y VEREDA; CONSTRUCCION DE CALZADA; EN EL(LA) CENTRO POBLADO DE QUINUABAMBA, DISTRITO DE QUINUABAMBA, PROVINCIA POMABAMBA, DEPARTAMENTO ANCASH";MUNICIPALIDAD DISTRITAL DE QUINUABAMBA;516,447;352;16;;;
49;2490296;ANCASH;"CONSTRUCCION DE VEREDA; REMODELACION DE AREA VERDE Y PISTA; EN EL(LA) CALLE 1, CALLE 2, AV. A, CALLE 3, CALLE 4, CALLE 5 Y AV. PANAMERICANA EN LA LOCALIDAD SAN PEDRO, DISTRITO DE SAMANCO, PROVINCIA SANTA, DEPARTAMENTO ANCASH";MUNICIPALIDAD DISTRITAL DE SAMANCO;574,578;50;17;;;
50;2262620;APURÍMAC;MEJORAMIENTO Y AMPLIACION DE LOS SERVICIOS DE AGUA POTABLE Y DISPOSICION SANITARIA DE EXCRETAS DE LA LOCALIDAD DE KULLCO , DISTRITO DE HUAYLLATI - GRAU - APURIMAC;PROGRAMA NACIONAL DE SANEAMIENTO RURAL;1,997,459.16;241;39;;;
51;2263285;APURÍMAC;MEJORAMIENTO Y AMPLIACION DE LOS SERVICIOS DE AGUA POTABLE Y DISPOSICION SANITARIA DE EXCRETAS DE LA LOCALIDAD DE CURCA , DISTRITO DE MARA - COTABAMBAS - APURIMAC;PROGRAMA NACIONAL DE SANEAMIENTO RURAL;2,213,159.02;242;44;;;
52;2289653;APURÍMAC;INSTALACION  DEL SISTEMA DE AGUA POTABLE Y SANEAMIENTO BASICO EN LA COMUNIDAD CAMPESINA UPINA, PROVINCIA DE COTABAMBAS - APURIMAC;MUNICIPALIDAD PROVINCIAL DE COTABAMBAS - TAMBOBAMBA;1,797,813.12;135;41;;;
53;2300630;APURÍMAC;MEJORAMIENTO DEL SISTEMA DE  AGUA POTABLE E INSTALACION DE UNIDADES BASICAS DE SANEAMIENTO EN LAS LOCALIDADES DE HABASPATA, HUAYÑURA, NUEVA ESPERANZA Y RATCAY DEL DISTRITO DE CURPAHUASI, PROVINCIA DE GRAU - APURIMAC;MUNICIPALIDAD DISTRITAL DE CURPAHUASI;4,042,057.34;913;70;;;
54;2308900;APURÍMAC;MEJORAMIENTO Y AMPLIACION INTEGRAL DE LOS SERVICIOS DE AGUA POTABLE Y ALCANTARILLADO DE LA LOCALIDAD DE TURPAY, DISTRITO DE TURPAY - GRAU - APURIMAC;MUNICIPALIDAD DISTRITAL DE TURPAY;4,810,750.00;959;72;;;
55;2239651;APURÍMAC;MEJORAMIENTO DEL SERVICIO DE SANEAMIENTO BASICO INTEGRAL EN LOS ANEXOS DE HUAYO GRANDE Y HUAYO CHICO, PUCURHUAY, IÑIRQUIPATA, HUASCARO PATIS Y TAMBORACCAY DEL DISTRITO DE CURPAHUASI, PROVINCIA DE GRAU - APURIMAC;MUNICIPALIDAD DISTRITAL DE CURPAHUASI;5,134,747.47;2,090;87;;;
56;2332871;APURÍMAC;MEJORAMIENTO Y AMPLIACIÓN DE LOS SERVICIOS DE SANEAMIENTO BÁSICO EN LA LOCALIDAD DE SAN ANTONIO, DISTRITO DE SAN ANTONIO - GRAU - APURIMAC;MUNICIPALIDAD DISTRITAL DE SAN ANTONIO;2,903,818.08;695;51;;;
57;2314813;APURÍMAC;CREACION DEL SISTEMA DE AGUA POTABLE E INSTALACIÓN DE LETRINAS CON BIODIGESTOR EN LOS ANEXOS DE CHUCHIN Y SARANI, DISTRITO DE TORAYA - AYMARAES - APURIMAC;MUNICIPALIDAD DISTRITAL DE TORAYA;1,542,661;172;40;;;
58;2456560;APURÍMAC;MEJORAMIENTO DEL SERVICIO DEL ESPACIO PUBLICO RECREACIONAL EN EL SECTOR  DE ROSASPATA DE LA LOCALIDAD DE HUACCANA DEL DISTRITO DE HUACCANA - PROVINCIA DE CHINCHEROS - DEPARTAMENTO DE APURIMAC;MUNICIPALIDAD DISTRITAL DE HUACCANA;306,605;2,046;10;;;
59;2413237;APURÍMAC;MEJORAMIENTO DEL SERVICIO DEL ESPACIO PÚBLICO EN LA PLAZA DE ARMAS DEL CENTRO POBLADO DE CHUPARO,  DISTRITO DE ANCO_HUALLO - PROVINCIA DE CHINCHEROS - DEPARTAMENTO DE APURIMAC;MUNICIPALIDAD PROVINCIAL DE CHINCHEROS;775,587;1,116;23;;;
60;2448772;APURÍMAC;CREACION DEL PARQUE RECREACIONAL INFANTIL EN LA LOCALIDAD DE COTARUSE DEL DISTRITO DE COTARUSE - PROVINCIA DE AYMARAES - DEPARTAMENTO DE APURIMAC;MUNICIPALIDAD DISTRITAL DE COTARUSE;304,658;1,278;10;;;
61;2478572;APURÍMAC;MEJORAMIENTO DEL SERVICIO DE TRANSITABILIDAD PEATONAL CON GRADERIAS EN LAS CALLES DE JR, JOSE MARIA ARGUEDAS, JR. MARIANO MELGAR Y JR. RICARDO PALMA DE LA LOCALIDAD DE TURPO,  DISTRITO DE TURPO - PROVINCIA DE ANDAHUAYLAS - DEPARTAMENTO DE APURIMAC;MUNICIPALIDAD DISTRITAL DE TURPO;1,330,477;1,585;40;;;
62;2418934;APURÍMAC;CREACION DE LOSA DE RECREACIÓN MULTIUSO EN LA LOCALIDAD DE PISONAYPATA  DISTRITO DE CURAHUASI - PROVINCIA DE ABANCAY - DEPARTAMENTO DE APURIMAC;MUNICIPALIDAD DISTRITAL DE CURAHUASI;524,249;730;16;;;
63;2491379;APURÍMAC;"CONSTRUCCION DE VEREDA, RAMPA, SARDINEL Y CALZADA; ADEMÁS DE OTROS ACTIVOS EN UN VIAS URBANAS EN LA LOCALIDAD HUACCANA, DISTRITO DE HUACCANA, PROVINCIA CHINCHEROS, DEPARTAMENTO APURIMAC";MUNICIPALIDAD DISTRITAL DE HUACCANA;812,409;120;25;;;
64;2492175;APURÍMAC;"CONSTRUCCION DE PISTA, VEREDA, CUNETA Y ALCANTARILLA; ADEMÁS DE OTROS ACTIVOS EN EL(LA) LOCALIDAD PATAYPAMPA DISTRITO DE PATAYPAMPA, PROVINCIA GRAU, DEPARTAMENTO APURIMAC";MUNICIPALIDAD DISTRITAL DE PATAYPAMPA;761,153;177;23;;;
65;2458126;APURÍMAC;MEJORAMIENTO DEL SERVICIO DE ESPACIO PUBLICO DE LA PLAZA DE ARMAS DEL CENTRO POBLADO DE PUMACHUCO DEL DISTRITO DE HUACCANA - PROVINCIA DE CHINCHEROS - DEPARTAMENTO DE APURIMAC;MUNICIPALIDAD DISTRITAL DE HUACCANA;629,747;936;19;;;
66;2418929;APURÍMAC;MEJORAMIENTO DEL SERVICIO DEL ESPACIO PUBLICO EN LA PLAZA DE ARMAS DE LA LOCALIDAD DE PISONAYPATA  DISTRITO DE CURAHUASI - PROVINCIA DE ABANCAY - DEPARTAMENTO DE APURIMAC;MUNICIPALIDAD DISTRITAL DE CURAHUASI;555,355;730;17;;;
67;2319393;AREQUIPA;MEJORAMIENTO DEL SERVICIO DEL SISTEMA DE AGUA POTABLE Y ALCANTARILLADO EN LOS 07  ASENTAMIENTOS HUMANOS DEL SECTOR DE UMAPALCA, DISTRITO DE SABANDIA, PROVINCIA DE AREQUIPA - AREQUIPA;MUNICIPALIDAD DISTRITAL DE SABANDIA;7,745,853;4,815;35;;;
68;2186390;AREQUIPA;MEJORAMIENTO, AMPLIACION DEL SISTEMA DE ALCANTARILLADO DE LA LOCALIDAD DE SALAMANCA, DISTRITO DE SALAMANCA - CONDESUYOS - AREQUIPA;MUNICIPALIDAD DISTRITAL DE SALAMANCA;2,803,599;547;56;;;
69;2458027;AREQUIPA;"CONSTRUCCION DE CALZADA DOBLE; EN EL(LA) AVENIDA  SOCABAYA URBANIZACION SAN MARTIN DE SOCABAYA DISTRITO DE SOCABAYA, PROVINCIA AREQUIPA, DEPARTAMENTO AREQUIPA";MUNICIPALIDAD DISTRITAL DE SOCABAYA;1,334,736;158;40;;;
70;2484127;AREQUIPA;"REPARACION DE CALZADA; EN EL(LA) AVENIDA EJERCITO INTERSECCIÓN CALLE MISTI - CALLE TRONCHADERO EN LA LOCALIDAD YANAHUARA, DISTRITO DE YANAHUARA, PROVINCIA AREQUIPA, DEPARTAMENTO AREQUIPA";MUNICIPALIDAD DISTRITAL DE YANAHUARA;657,395;292;20;;;
71;2258771;AREQUIPA;MEJORAMIENTO DE LA TRANSITABILIDAD VEHICULAR Y PEATONAL EN  LA ASOCIACION DE PEQUEÑOS INDUSTRIALES Y ARTESANOS DE AREQUIPA EN EL DISTRITO DE  YURA, PROVINCIA DE AREQUIPA - AREQUIPA- II ETAPA;MUNICIPALIDAD DISTRITAL DE YURA;13,256,996;7,105;385;;;
72;2492203;AREQUIPA;"REPARACION DE CALZADA, VEREDA, BERMA Y AREA VERDE; EN EL(LA) P.J. ALTO SELVA ALEGRE, ZONA B Y C DISTRITO DE ALTO SELVA ALEGRE, PROVINCIA AREQUIPA, DEPARTAMENTO AREQUIPA ";MUNICIPALIDAD DISTRITAL DE ALTO SELVA ALEGRE;950,406;140;29;;;
73;2492148;AREQUIPA;"CONSTRUCCION DE VEREDA, BERMA Y AREA VERDE; EN EL(LA) VIA PRINCIPAL DEL PUEBLO JOVEN ATALAYA DISTRITO DE MARIANO MELGAR, PROVINCIA AREQUIPA, DEPARTAMENTO AREQUIPA";MUNICIPALIDAD DISTRITAL DE MARIANO MELGAR;597,352;967;18;;;
74;2492174;AREQUIPA;"REPARACION DE VEREDA, BERMA, CALZADA Y SARDINEL; ADEMÁS DE OTROS ACTIVOS EN EL(LA) LA CALLE ELIAS AGUIRRE (CUADRA 3 Y 4) Y CALLE HUANUCO (CUADRA 1 Y 2) EN EL PUEBLO TRADICIONAL URBANIZACIÓN MARIANO MELGAR, DISTRITO DE MARIANO MELGAR, PROVINCIA AREQUIPA, DEPARTAMENTO AREQUIPA ";MUNICIPALIDAD DISTRITAL DE MARIANO MELGAR;699,589;520;21;;;
75;2491939;AREQUIPA;"REPARACION DE CALZADA, VEREDA, SARDINEL Y AREA VERDE; EN EL(LA) PISTAS Y VEREDAS EN LA LOCALIDAD PUCCHUN, DISTRITO DE MARISCAL CACERES, PROVINCIA CAMANA, DEPARTAMENTO AREQUIPA";MUNICIPALIDAD DISTRITAL DE MARISCAL CACERES;1,013,277;80;31;;;
76;2491709;AREQUIPA;"REPARACION DE CALZADA, VEREDA, BERMA Y RAMPA; ADEMÁS DE OTROS ACTIVOS EN LA URBANIZACION VICTORIA  DISTRITO DE AREQUIPA, PROVINCIA AREQUIPA, DEPARTAMENTO AREQUIPA";MUNICIPALIDAD PROVINCIAL DE AREQUIPA;921,354;134;28;;;
77;2491618;AREQUIPA;"REMODELACION DE CALZADA Y VEREDA; CONSTRUCCION DE RAMPA; EN EL(LA) URBANIZACION MARIA ISABEL  DISTRITO DE AREQUIPA, PROVINCIA AREQUIPA, DEPARTAMENTO AREQUIPA";MUNICIPALIDAD PROVINCIAL DE AREQUIPA;891,270;168;26;;;
78;2331669;AYACUCHO;MEJORAMIENTO Y AMPLIACIÓN DEL SERVICIO DE AGUA POTABLE Y CREACION DE LA PLANTA DE TRATAMIENTO DE AGUA POTABLE EN PACAYCASA, DISTRITO DE PACAYCASA - HUAMANGA - AYACUCHO;MUNICIPALIDAD DISTRITAL DE PACAICASA;11,861,902;3,160;55;;;
79;2331397;AYACUCHO;MEJORAMIENTO Y AMPLIACION DEL SISTEMA DE AGUA POTABLE Y ALCANTARILLADO SANITARIO EN EL SECTOR DE WAYCHAOPAMPA PARTE ALTA Y BARRIO ANDAMARCA DE LA COMUNIDAD CAMPESINA ANDAMARCA, DISTRITO DE AYACUCHO, PROVINCIA DE HUAMANGA - AYACUCHO;MUNICIPALIDAD PROVINCIAL DE HUAMANGA;2,559,546;1,238;27;;;
80;2258410;AYACUCHO;AMPLIACION, MEJORAMIENTO DEL SERVICIO DE AGUA POTABLE Y SANEAMIENTO BASICO DEL CENTRO POBLADO TRANCA CONCEPCION 8 DE DICIEMBRE, DISTRITO DE VINCHOS, PROVINCIA DE HUAMANGA, DEPARTAMENTO DE AYACUCHO;PROGRAMA NACIONAL DE SANEAMIENTO RURAL;1,736,751.92;314;28;;;
81;2330740;AYACUCHO;CREACION DEL SERVICIO DE AGUA POTABLE Y UNIDADES BASICAS DE SANEAMIENTO EN LA COMUNIDAD DE PALLCCAS, DISTRITO DE CHUNGUI - LA MAR - AYACUCHO;MUNICIPALIDAD DISTRITAL DE CHUNGUI;2,262,063.00;356;64;;;
82;2337075;AYACUCHO;MEJORAMIENTO Y AMPLIACION DEL SERVICIO DE AGUA POTABLE E INSTALACION DEL SERVICIO DE ALCANTARILLADO EN LA LOCALIDAD DE  MOYABAMBA-CHINCHIBAMBA, DISTRITO DE CHUNGUI, PROVINCIA DE LA MAR - AYACUCHO;MUNICIPALIDAD DISTRITAL DE CHUNGUI;3,889,747.67;694;100;;;
83;2235389;AYACUCHO;INSTALACION DEL SISTEMA DE ALCANTARILLADO Y MEJORAMIENTO DEL SISTEMA DE AGUA POTABLE DE LAS COMUNIDADES DE QOYA QOYA, PAQPAPATA, CCOLLCCABAMBA, LARAMPUQUIO, MAUCALLACTA, PUCALOMA Y MARQARI, DISTRITO DE SOCOS - HUAMANGA - AYACUCHO;MUNICIPALIDAD DISTRITAL DE SOCOS;7,648,699.68;2,525;97;;;
84;2301890;AYACUCHO;AMPLIACION Y MEJORAMIENTO DEL SISTEMA DE AGUA POTABLE, INSTALACION DEL SISTEMA DE ALCANTARILLADO Y PLANTA DE TRATAMIENTO DE AGUAS RESIDUALES EN LAS LOCALIDADES DE ANCHAC HUASI, MITAPA SAMANAN Y SAN JOSÉ DE MAYOBAMBA, DISTRITO DE VINCHOS - HUAMANGA - AYACUCHO;MUNICIPALIDAD DISTRITAL DE VINCHOS;5,716,583.77;1,435;76;;;
85;2376877;AYACUCHO;MEJORAMIENTO Y AMPLIACIÓN DEL SERVICIO  DE AGUA POTABLE E INSTALACIÓN DE SANEAMIENTO BÁSICO EN LAS COMUNIDADES DE  CHILINGA - AQUILLA - CHACCO DISTRITO DE SAN MIGUEL, PROVINCIA DE LA MAR - AYACUCHO;MUNICIPALIDAD PROVINCIAL DE LA MAR - SAN MIGUEL;3,110,000.54;765;71;;;
86;2240899;AYACUCHO;AMPLIACION DEL SERVICIO DE AGUA POTABLE Y SANEAMIENTO EN LAS COMUNIDADES DE HUALLHUAYOCC  ALTO, UYUVIRCA Y ESPIRITU SANTO, DISTRITO DE  HUANTA, PROVINCIA DE HUANTA - AYACUCHO;MUNICIPALIDAD PROVINCIAL DE HUANTA;8,481,855.26;3,308;167;;;
87;2300757;AYACUCHO;MEJORAMIENTO Y AMPLIACION DEL SERVICIO DE AGUA POTABLE E INSTALACION DE LETRINAS UBS CON ARRASTRE HIDRAULICO EN LAS COMUNIDADES DE PRAMADERA, MUCHCAPATA, SAN FRANCISCO DE ASIS, SANTA ROSA DE HUARACASCCA, DISTRITO DE SAURAMA - VILCAS HUAMAN - AYACUCHO;MUNICIPALIDAD DISTRITAL DE SAURAMA;4,497,557.85;926;89;;;
88;2216309;AYACUCHO;MEJORAMIENTO, AMPLIACION E IMPLEMENTACIÓN DEL SERVICIO DE AGUA POTABLE Y SANEAMIENTO  EN 08 CENTROS POBLADOS, DISTRITO DE LLOCHEGUA - HUANTA - AYACUCHO;MUNICIPALIDAD DISTRITAL DE LLOCHEGUA;13,108,545.54;2,875;262;;;
89;2327008;AYACUCHO;MEJORAMIENTO Y AMPLIACION DE LOS SERVICIOS DEL  SISTEMA  DE AGUA POTABLE Y CREACION DE SANEAMIENTO RURAL  EN LAS COMUNIDADES DE MARAYCERA, PUITOCC, SALLALLI Y QUISHUARCANCHA, DISTRITO DE CHIARA - HUAMANGA - AYACUCHO;MUNICIPALIDAD DISTRITAL DE CHIARA;8,987,875.47;1,080;125;;;
90;2321900;AYACUCHO;MEJORAMIENTO Y AMPLIACIÓN DE LOS SERVICIOS DE AGUA POTABLE E INSTALACIÓN DE UNIDADES BÁSICAS DE SANEAMIENTO EN LAS COMUNIDADES DE CCANOBAMBA, MATARILLA, PAUCARPATA Y QUICHKAPATA, DISTRITO DE ACOS VINCHOS - HUAMANGA - AYACUCHO;MUNICIPALIDAD DISTRITAL DE ACOS VINCHOS;4,377,125.00;839;175;;;
91;2252841;AYACUCHO;MEJORAMIENTO AMPLIACIÓN Y REHABILITACIÓN DE LOS SISTEMAS DE AGUA POTABLE, ALCANTARILLADO Y TRATAMIENTO DE AGUAS RESIDUALES EN EL CENTRO POBLADO DE HUAYLLAY, DISTRITO DE LURICOCHA - HUANTA - AYACUCHO;MUNICIPALIDAD DISTRITAL DE LURICOCHA;8,127,004.84;1,121;137;;;
92;2201545;AYACUCHO;AMPLIACION Y MEJORAMIENTO DE AGUA POTABLE E INSTALACION DE LETRINAS EN DOCE ANEXOS DEL CENTRO POBLADO DE CHONTACA, DISTRITO DE ACOCRO - HUAMANGA - AYACUCHO;MUNICIPALIDAD DISTRITAL DE ACOCRO;11,395,007.15;2,600;120;;;
93;2323204;AYACUCHO;MEJORAMIENTO Y AMPLIACIÓN DE LOS SERVICIOS DE AGUA POTABLE, ALCANTARILLADO, RECUPERACIÓN DE TRATAMIENTO DE AGUAS RESIDUALES E INSTALACIÓN DE UNIDADES BÁSICAS DE SANEAMIENTO EN LAS LOCALIDADES DE CARAPO Y SAN MIGUEL DE MANCHIRI, DISTRITO DE CARAPO - HUANCA SANCOS - AYACUCHO;MUNICIPALIDAD DISTRITAL DE CARAPO;4,103,694.05;2,058;62;;;
94;2333244;AYACUCHO;CREACION DEL SISTEMA DE AGUA POTABLE Y DISPOSICION SANITARIA DE EXCRETAS EN LA LOCALIDAD DE LISAHUACCHI EN EL, DISTRITO DE SAISA - LUCANAS - AYACUCHO;MUNICIPALIDAD DISTRITAL DE SAISA;1,156,466.65;77;45;;;
95;2309963;AYACUCHO;MEJORAMIENTO Y CREACION DEL SERVICIO DE AGUA POTABLE Y SANEAMIENTO EN LAS COMUNIDADES DE PUMAPUQUIO, PAMPAMARCA BAJA Y CCOCHANI, DISTRITO DE ACOCRO - HUAMANGA - AYACUCHO;MUNICIPALIDAD DISTRITAL DE ACOCRO;8,737,497.58;1,390;129;;;
96;2324863;AYACUCHO;MEJORAMIENTO DEL SISTEMA DE AGUA POTABLE Y CREACIÓN DEL SISTEMA DE ALCANTARILLADO Y TRATATAMIENTO DE AGUAS RESIDUALES EN LAS LOCALIDADES DE LLAHUECCMARCA, CALLEJON, CALDERA, SAN FRANCISCO DE OCCECHIPA, CUSI VALLE SAN FANCISCO Y SAN PEDRO DE VACAHUASI, DISTRITO DE OCROS - HUAMANGA - AYACUCHO;MUNICIPALIDAD DISTRITAL DE OCROS;8,341,840.64;1,019;123;;;
97;2336051;AYACUCHO;CREACION, MEJORAMIENTO Y AMPLIACION DEL SISTEMA DE AGUA POTABLE Y SANEAMIENTO BASICO EN COMUNIDADES DE LARAMATE, SAN JOSE DE MICHCA, CCAYARPACHI, CRUZ CUCHO Y SANTIAGO DE PISCHA, DISTRITO DE SANTIAGO DE PISCHA - HUAMANGA - AYACUCHO;MUNICIPALIDAD DISTRITAL DE SANTIAGO DE PISCHA;11,355,325.19;1,490;135;;;
98;2314411;AYACUCHO;MEJORAMIENTO Y AMPLIACIÓN DE AGUA Y SANEAMIENTO BÁSICO  EN LAS LOCALIDADES DE  SAYHUAPATA, PATASUYO A,   PATASUYO B, CHIHUAMPAMPA, MITUCCASA Y PARACCAY EN EL, DISTRITO DE QUINUA - HUAMANGA - AYACUCHO;MUNICIPALIDAD DISTRITAL DE QUINUA;4,155,265.18;1,632;83;;;
99;2289091;AYACUCHO;CREACION DEL SISTEMA DE ALCANTARILLADO SANITARIO Y TRATAMIENTO DE AGUAS RESIDUALES EN EL CENTRO POBLADO DE MARCCARI, DISTRITO DE SANTILLANA - HUANTA - AYACUCHO;MUNICIPALIDAD DISTRITAL DE SANTILLANA;3,012,508;406;59;;;
