399;2492160;LAMBAYEQUE;"REPARACION DE PAVIMENTO Y VEREDA; EN EL(LA) EN LAS CALLES: AV. CHICLAYO CUADRA 13 HASTA LA 30, ANCASH CUADRA 12, GRAU CUADRA 11, INTERSECCIONES DE CALLE MIGUEL IGLESIAS Y AV. CHICLAYO E INTERSECCIONES DE CALLE TUPAC AMARU Y AV. CHICLAYO, EN LA LOCALIDAD CHONGOYAPE, DISTRITO DE CHONGOYAPE, PROVINCIA CHICLAYO, DEPARTAMENTO LAMBAYEQUE";MUNICIPALIDAD DISTRITAL DE CHONGOYAPE;1,768,223;482;52;;;
400;2492113;LAMBAYEQUE;"REPARACION DE VEREDA; EN EL(LA) CALLES DEL CENTRO HISTÓRICO DE LA CIUDAD DE LAMBAYEQUE DISTRITO DE LAMBAYEQUE, PROVINCIA LAMBAYEQUE, DEPARTAMENTO LAMBAYEQUE.";MUNICIPALIDAD PROVINCIAL DE LAMBAYEQUE;1,343,144;2,200;40;;;
401;2492117;LAMBAYEQUE;REHABILITACION DE PISTAS Y VEREDAS EN LAS CALLES DE LA URBANIZACIÓN TÚPAC AMARU, DISTRITO DE PIMENTEL - CHICLAYO - LAMBAYEQUE;MUNICIPALIDAD DISTRITAL DE PIMENTEL;1,070,908;475;32;;;
402;2462543;LIMA;"RENOVACION DE RED DE DISTRIBUCION Y RED DE ALCANTARILLADO; EN EL(LA) SISTEMA DE AGUA POTABLE Y ALCANTARILLADO URB. TELLO VELARDE DISTRITO DE BARRANCA, PROVINCIA BARRANCA, DEPARTAMENTO LIMA";EPS BARRANCA;1,162,362.65;" 1697
";100;;;
403;2444190;LIMA;"ADQUISICION DE MICROMEDIDORES; EN EL(LA) EPS EMAPA HUARAL S.A. (4150 UNIDADES), DISTRITO DE HUARAL, PROVINCIA HUARAL, DEPARTAMENTO LIMA ";EMAPA HUARAL;1,178,448.00;17,845;50;;;
404;2447588;LIMA;"ADQUISICION DE CAMION CISTERNA, CAMION TOLVA Y CAMIONETA; EN EL(LA) OPTIMIZACION RENOVACION DE UNIDADES MOVILES PARA EMAPA CAÑETE S.A. EN LA LOCALIDAD SAN VICENTE DE CAÑETE, DISTRITO DE SAN VICENTE DE CAÑETE, PROVINCIA CAÑETE, DEPARTAMENTO LIMA , F-08-GO";EMPRESA PRESTADORA DE SERVICIOS DE SANEAMIENTO MUNICIPAL DE AGUA POTABLE Y ALCANTARILLADO DE CAÑETE;546,190.70;30,000;4;;;
405;2464086;LIMA;CREACION DEL PARQUE INFANTIL VIRGEN DEL BUEN PASO EN EL AA.HH. VIRGEN DEL BUEN PASO, ZONA PAMPLONA ALTA DEL DISTRITO DE SAN JUAN DE MIRAFLORES - PROVINCIA DE LIMA - DEPARTAMENTO DE LIMA;MUNICIPALIDAD DISTRITAL DE SAN JUAN DE MIRAFLORES;200,853;1,857;7;;;
406;2408118;LIMA;CREACION DEL PARQUE GUSTAVO TELLO VELARDE EN LA ZONA DE CHOCOY - DISTRITO DE BARRANCA - PROVINCIA DE BARRANCA - DEPARTAMENTO DE LIMA;MUNICIPALIDAD PROVINCIAL DE BARRANCA;384,754;2,028;12;;;
407;2460897;LIMA;CREACION DE LOS SERVICIOS DE TRANSITABILIDAD VEHICULAR Y PEATONAL DE LAS CALLES INTERNAS DEL AA.HH. SANTA CRUZ DEL NORTE DEL DISTRITO DE SAN MARTIN DE PORRES - PROVINCIA DE LIMA - DEPARTAMENTO DE LIMA;MUNICIPALIDAD DISTRITAL DE SAN MARTIN DE PORRES;2,213,705;2,029;66;;;
408;2136845;LIMA;CREACION DEL SERVICIO DE TRANSITABILIDAD VEHICULAR Y PEATONAL EN EL ASENTAMIENTO HUMANO SOL NACIENTE DE CARABAYLLO I ETAPA  DISTRITO DE CARABAYLLO - PROVINCIA DE LIMA - DEPARTAMENTO DE LIMA;MUNICIPALIDAD DISTRITAL DE CARABAYLLO;4,301,256;2,150;126;;;
409;2281780;LIMA;CREACION DE PISTAS Y VEREDAS EN LAS CALLES INTERNAS DE LA ZONA J DEL P.J. PROYECTO ESPECIAL HUAYCAN, ZONA 07, DEL DISTRITO DE ATE - PROVINCIA DE LIMA - DEPARTAMENTO DE LIMA;MUNICIPALIDAD DISTRITAL DE ATE - VITARTE;4,807,762;4,987;141;;;
410;2414614;LIMA;MEJORAMIENTO DEL SERVICIO DE TRANSITABILIDAD PEATONAL Y VEHICULAR EN LA AV. LOS JAZMINES, EJE ZONAL ERMITAÑO DEL DISTRITO DE INDEPENDENCIA - PROVINCIA DE LIMA - DEPARTAMENTO DE LIMA;MUNICIPALIDAD DISTRITAL DE INDEPENDENCIA;4,896,622;8,720;143;;;
411;2485465;LIMA;"REPARACION DE VEREDA Y BERMA; EN EL(LA) REHABILITACIÓN DEL SERVICIO DE TRANSITABILIDAD PEATONAL Y ESTACIONAMIENTO VEHICULAR EN LA AV. GARCIA RADA DE LA AGRUPACION DE FAMILIAS SANTA CRUZ DISTRITO DE PUNTA HERMOSA, PROVINCIA LIMA, DEPARTAMENTO LIMA";MUNICIPALIDAD DISTRITAL DE PUNTA HERMOSA;1,794,182;207;53;;;
412;2426258;LIMA;"REPARACIÓN DE VIAS VECINALES; EN EL(LA) TRAMO 1-609 - CALLE 28 DE  ENERO DESDE LA CRUZ HASTA LOSA DEPORTIVA. EN LA LOCALIDAD LACHAQUI, DISTRITO DE LACHAQUI, PROVINCIA CANTA, DEPARTAMENTO LIMA";MUNICIPALIDAD DISTRITAL DE LACHAQUI;1,780,062;587;52;;;
413;2381406;LIMA;REHABILITACION DE PISTA DE LA AVENIDA 7 DE JUNIO DE LA URBANIZACION LOS ROBLES, URBANIZACION LOS FICUS Y LA URBANIZACION LA ACHIRANA 2DA ETAPA, DISTRITO DE SANTA ANITA, LIMA - LIMA;MUNICIPALIDAD DISTRITAL DE SANTA ANITA;1,308,181;173;39;;;
414;2485620;LIMA;"RENOVACION DE PISTA Y VEREDA; REPARACION DE PISTA; EN EL(LA) LOS JIRONES ALFONSO UGARTE, MANUEL DE LA FUENTE CHÁVEZ, GENERAL ISAAC RECAVARREN, MARIANO DE LOS SANTOS, TNTE. MANUEL WAGNER, RODRÍGUEZ SOTO Y OTROS, EN EL CUADRANTE 25 - SECTOR 1, EN LA LOCALIDAD SANTIAGO DE SURCO, DISTRITO DE SANTIAGO DE SURCO, PROVINCIA LIMA, DEPARTAMENTO LIMA";MUNICIPALIDAD DISTRITAL DE SANTIAGO DE SURCO;1,209,684;3,786;36;;;
415;2336110;LIMA;MEJORAMIENTO DE LA AV. SUCRE CUADRA 02 A LA CUADRA 14 DEL DISTRITO DE MAGDALENA DEL MAR - LIMA - LIMA;MUNICIPALIDAD DISTRITAL DE MAGDALENA DEL MAR;601,648;694;19;;;
416;2458460;LIMA;"REPARACION DE PISTA; EN EL(LA) PISTAS Y VEREDAS DE LA AV. SEPARADORA INDUSTRIAL TRAMO: AV. LOS QUECHUAS - AV. CIRCUNVALACIÓN Y AV. LOS MOCHICAS  TRAMO JR. LAS AZUCENAS - AV. LOS QUECHUAS EN LA LOCALIDAD VITARTE, DISTRITO DE ATE, PROVINCIA LIMA, DEPARTAMENTO LIMA";MUNICIPALIDAD DISTRITAL DE ATE - VITARTE;1,046,573;1,870;31;;;
417;2487530;LIMA;"RENOVACION DE VIAS DE ACCESO; ADQUISICION DE MOBILIARIO URBANO; EN EL(LA) ESPACIOS PEATONALES EN LA AV. 28 DE JULIO EN LA LOCALIDAD MIRAFLORES, DISTRITO DE MIRAFLORES, PROVINCIA LIMA, DEPARTAMENTO LIMA";MUNICIPALIDAD DISTRITAL DE MIRAFLORES;1,034,442;1,143;31;;;
418;2484415;LIMA;"REPARACION DE PISTA Y VEREDA; EN EL(LA) CALLE PARIS Y PASAJE BRUSELAS URB. MARANGA V ETAPA DISTRITO DE SAN MIGUEL, PROVINCIA LIMA, DEPARTAMENTO LIMA";MUNICIPALIDAD DISTRITAL DE SAN MIGUEL;920,889;1,787;28;;;
419;2410559;LIMA;"RENOVACIÓN DE VIAS URBANAS; EN EL(LA) TRAMO  CALLE  MANCO CAPAC  DESDE  EL COLISEO  HASTA COMERCIO, TRAMO  CALLE CANTA DESDE COMEDOR HASTA PASAJE ICA, TRAMO  CALLE  CAÑETE  DESDE  COMERCIO HASTA JR. CAÑETE PLAZA DE ARMAS, TRAMO  CALLE SAN CRISTOBAL DESDE CAÑETE HASTA BOLÍVAR EN LA LOCALIDAD CHOCOS, DISTRITO DE CHOCOS, PROVINCIA YAUYOS, DEPARTAMENTO LIMA";MUNICIPALIDAD DISTRITAL DE CHOCOS;422,695;94;14;;;
420;2426768;LIMA;"RENOVACIÓN DE PISTAS Y DRENAJE DE AGUA PLUVIALES; EN EL(LA) REHABILITACIÓN DE LA AVENIDA LOS PINOS DEL ANEXO DE BARBABLANCA  DISTRITO DE CALLAHUANCA, PROVINCIA HUAROCHIRI, DEPARTAMENTO LIMA";MUNICIPALIDAD DISTRITAL DE CALLAHUANCA;870,929;640;26;;;
421;2484340;LIMA;"REPARACION DE PISTA Y VEREDA; EN EL(LA) AV. RIVA AGUERO CDRA. 1 Y 2, CALLE GENERAL MOORE CDRA. 2, CALLE VILLAVICENCIO CDRA. 2 Y JR. LIMA CDRA. 11 URBANIZACIÓN  PANDO II ETAPA DISTRITO DE SAN MIGUEL, PROVINCIA LIMA, DEPARTAMENTO LIMA";MUNICIPALIDAD DISTRITAL DE SAN MIGUEL;743,051;1,787;23;;;
422;2469760;LIMA;"CONSTRUCCION DE VEREDA, PAVIMENTO Y AREA VERDE; EN EL(LA) CALLE LOS JARDINES, LAS FLORES, SAN MARTÍN, JUAN VELASCO DEL A.H ANTONIO RAIMONDI DISTRITO DE HUAURA, PROVINCIA HUAURA, DEPARTAMENTO LIMA";MUNICIPALIDAD DISTRITAL DE HUAURA;687,481;284;21;;;
423;2481425;LIMA;"REPARACION DE VEREDA; EN EL(LA) AV. HUAYLAS  DISTRITO DE LOS OLIVOS, PROVINCIA LIMA, DEPARTAMENTO LIMA";MUNICIPALIDAD DISTRITAL DE LOS OLIVOS;556,210;3,749;17;;;
424;2137651;LIMA;CONSTRUCCION DE PISTAS, VEREDAS Y HABILITACIÓN DE ÁREAS VERDES EN EL A.H. UPIS SAN JOSÉ DE LURN, ZONA E, DISTRITO DE LURIN - LIMA - LIMA;MUNICIPALIDAD DISTRITAL DE LURIN;2,918,582;748;86;;;
425;2211303;LIMA;MEJORAMIENTO DE LA INFRAESTRUCTURA VIAL EN EL CC.PP. PRIMAVERA, DISTRITO DE VEGUETA - HUAURA - LIMA;MUNICIPALIDAD DISTRITAL DE VEGUETA;5,217,907;1,800;153;;;
426;2405364;LIMA;CREACION DE LOS SERVICIOS DE TRANSITABILIDAD VEHICULAR Y PEATONAL EN LA ASOCIACION PRO VIVIENDA SAN PEDRO DE ANCON, DEL DISTRITO DE ANCON - PROVINCIA DE LIMA - DEPARTAMENTO DE LIMA;MUNICIPALIDAD DISTRITAL DE ANCON;1,690,989;2,940;50;;;
427;2408136;LIMA;CREACION DE PARQUE RECREATIVO EN EL CENTRO POBLADO PRIMAVERA - DISTRITO DE VEGUETA - PROVINCIA DE HUAURA - DEPARTAMENTO DE LIMA;MUNICIPALIDAD DISTRITAL DE VEGUETA;376,296;902;12;;;
428;2409828;LIMA;CREACION DE PARQUE INFANTIL DE LA zona 06 del anexo 08 - DISTRITO DE SAN ANTONIO - PROVINCIA DE HUAROCHIRI - DEPARTAMENTO DE LIMA;MUNICIPALIDAD DISTRITAL DE SAN ANTONIO;355,599;72,970;11;;;
429;2432217;LIMA;CREACION DEL SERVICIO DE TRANSITABILIDAD VEHICULAR Y PEATONAL EN LA AVENIDA LOS CONSTRUCTORES Y AVENIDA LOS CLAVELES, TRAMO DESDE LA ASOC. ESPERANZA HASTA EL A.H. 27 DE OCTUBRE  DISTRITO DE CARABAYLLO - PROVINCIA DE LIMA - DEPARTAMENTO DE LIMA;MUNICIPALIDAD DISTRITAL DE CARABAYLLO;3,446,429;4,514;101;;;
430;2444096;LIMA;CREACION DEL SERVICIO DE TRANSITABILIDAD VEHICULAR Y PEATONAL EN LA ASOCIACIÓN PRO VIVIENDA LOS SUSPIROS, ZONA A DEL DISTRITO DE LURIN - PROVINCIA DE LIMA - DEPARTAMENTO DE LIMA;MUNICIPALIDAD DISTRITAL DE LURIN;6,012,309;1,705;176;;;
431;2465772;LIMA;MEJORAMIENTO DE LOS SERVICIOS DE TRANSITABILIDAD VEHICULAR Y PEATONAL DEL JIRÓN GENERAL JOSÉ DE CANTERAC EN JESUS MARIA DEL DISTRITO DE JESUS MARIA - PROVINCIA DE LIMA - DEPARTAMENTO DE LIMA;MUNICIPALIDAD DISTRITAL DE JESUS MARIA;1,448,247;5,676;43;;;
432;2473485;LIMA;CREACION DEL SERVICIO DE ESPACIOS PUBLICOS VERDES EN LA UP. ARIA LAS DELICIAS DE VILLA ZONA I CHORRILLOS DEL DISTRITO DE CHORRILLOS - PROVINCIA DE LIMA - DEPARTAMENTO DE LIMA;MUNICIPALIDAD DISTRITAL DE CHORRILLOS;357,243;5,035;11;;;
433;2478711;LIMA;CREACION DE LOS SERVICIOS RECREATIVOS Y ESPARCIMIENTO EN LA ASOCIACIÓN PRO VIVIENDA LOS SUSPIROS, ZONA A DEL DISTRITO DE LURIN - PROVINCIA DE LIMA - DEPARTAMENTO DE LIMA;MUNICIPALIDAD DISTRITAL DE LURIN;351,171;2,342;11;;;
434;2449791;LIMA;CREACION DEL SERVICIO RECREATIVO DEL PARQUE CENTRAL DEL A. H. PRÍNCIPE DE ASTURIAS EN EL  DISTRITO DE VILLA EL SALVADOR - PROVINCIA DE LIMA - DEPARTAMENTO DE LIMA;MUNICIPALIDAD DISTRITAL DE VILLA EL SALVADOR;317,473;4,338;11;;;
435;2451075;LIMA;CREACION DE LOSA DEPORTIVA DE USO MULTIPLE ENTRE EL JIRON REPUBLICA CON EL JIRON UNIÓN EN TABLADA DE LURIN, ZONA 5 TABLADA DE LURIN,  DISTRITO DE VILLA MARIA DEL TRIUNFO - PROVINCIA DE LIMA - DEPARTAMENTO DE LIMA;MUNICIPALIDAD DISTRITAL DE VILLA MARIA DEL TRIUNFO;459,315;660;14;;;
436;2243537;LIMA;CONSTRUCCION DE PISTAS  EN LAS UCV 132, 132-B, 133, 134, 135, 136, 137, 138, 139 Y 139-B,  ZONA I, HUAYCAN, ZONA 06, SUB ZONA 03, DISTRITO DE ATE - LIMA - LIMA;MUNICIPALIDAD DISTRITAL DE ATE - VITARTE;5,652,649;3,540;165;;;
437;2221681;LIMA;MEJORAMIENTO DE CALLES CON PAVIMENTO EN EL A.H. JESUS OROPEZA CHONTA, DISTRITO DE PUENTE PIEDRA - LIMA - LIMA;MUNICIPALIDAD DISTRITAL DE PUENTE PIEDRA;3,740,685;2,254;110;;;
438;2407109;LIMA;CREACION DE LOS SERVICIOS RECREATIVOS EN EL PARQUE DE LA MZ. E LT 7 DEL AA.HH. PORTADA DE MANCHAY III, ZONA 5 QUEBRADA DE MANCHAY - DISTRITO DE PACHACAMAC - PROVINCIA DE LIMA - DEPARTAMENTO DE LIMA;MUNICIPALIDAD DISTRITAL DE PACHACAMAC;553,539;1,741;17;;;
439;2451088;LIMA;CREACION DEL PARQUE SAN ROQUE EN JOSE GALVEZ, ZONA 6 JOSE GALVEZ,  DISTRITO DE VILLA MARIA DEL TRIUNFO - PROVINCIA DE LIMA - DEPARTAMENTO DE LIMA;MUNICIPALIDAD DISTRITAL DE VILLA MARIA DEL TRIUNFO;344,485;881;11;;;
440;2392341;LIMA;CREACION DE LA PLAZUELAS EN LA ASOCIACION PRO-VIVIENDA CORONEL PEDRO PORTILLO SILVA DEL  DISTRITO DE HUAURA - PROVINCIA DE HUAURA - DEPARTAMENTO DE LIMA;MUNICIPALIDAD DISTRITAL DE HUAURA;267,777;1,350;9;;;
441;2491966;LIMA;"REPARACION DE PISTA Y VEREDA; EN EL(LA) JIRON MADRE SELVA DE LA COOPERATIVA DE VIVIENDAS MUSA, DISTRITO DE LA MOLINA, PROVINCIA LIMA, DEPARTAMENTO LIMA";MUNICIPALIDAD DISTRITAL DE LA MOLINA;583,759;290;18;;;
442;2492302;LIMA;"REPARACION DE PISTA; EN EL(LA) AV. NUEVA TOLEDO TRAMO (AV. MALECON LURÍN HASTA LA CA. PINGOYO) PARCELACION CIENEGUILLA I ETAPA DISTRITO DE CIENEGUILLA, PROVINCIA LIMA, DEPARTAMENTO LIMA";MUNICIPALIDAD DISTRITAL DE CIENEGUILLA;978,981;6,936;29;;;
443;2492212;LIMA;CONSTRUCCIÓN DE CALZADA, SARDINELES, BERMA, VEREDA Y AREA VERDE EN EL PUEBLO JOVEN URBANIZACION POPULAR EL ERMITAÑO ZONA MEDIA, EJE ZONAL ERMITAÑO, DISTRITO DE INDEPENDENCIA LIMA  LIMA.;MUNICIPALIDAD DISTRITAL DE INDEPENDENCIA;1,344,231;4,120;40;;;
444;2492208;LIMA;"REPARACION DE PISTA Y VEREDA; EN EL(LA) DE PISTAS Y VEREDAS DEL CERCADO DE SURQUILLO EN LA LOCALIDAD SURQUILLO, DISTRITO DE SURQUILLO, PROVINCIA LIMA, DEPARTAMENTO LIMA";MUNICIPALIDAD DISTRITAL DE SURQUILLO;754,308;304;23;;;
445;2492075;LIMA;"REPARACION DE VEREDA; EN EL(LA) JIRON LEONCIO PRADO ENTRE LAS CUADRAS 1 Y 10 EN LA LOCALIDAD MAGDALENA DEL MAR, DISTRITO DE MAGDALENA DEL MAR, PROVINCIA LIMA, DEPARTAMENTO LIMA";MUNICIPALIDAD DISTRITAL DE MAGDALENA DEL MAR;513,639;300;16;;;
446;2492286;LIMA;"RENOVACION DE PAVIMENTO; EN EL(LA) JR. AYACUCHO EN LA LOCALIDAD CHANCAY, DISTRITO DE CHANCAY, PROVINCIA HUARAL, DEPARTAMENTO LIMA";MUNICIPALIDAD DISTRITAL DE CHANCAY;522,892;104;16;;;
447;2492279;LIMA;"RENOVACION DE PAVIMENTO; EN EL(LA) CA. SAN MARTIN Y PROLONGACION SAN MARTIN EN LA LOCALIDAD CHANCAY, DISTRITO DE CHANCAY, PROVINCIA HUARAL, DEPARTAMENTO LIMA";MUNICIPALIDAD DISTRITAL DE CHANCAY;723,579;115;22;;;
448;2492285;LIMA;CONSTRUCCION DE PISTA EN EL CERCADO DEL DISTRITO DE NUEVO IMPERIAL, PROVINCIA CAÑETE, DEPARTAMENTO LIMA; MUNICIPALIDAD DISTRITAL DE NUEVO IMPERIAL;560,930;207;17;;;
449;2491981;LIMA;"REPARACION DE CALZADA; EN EL(LA) DE LAS CALLES INTERNAS DEL PUEBLO TRADICIONAL DEL CERCADO DE PACHACAMAC, DISTRITO DE PACHACAMAC, PROVINCIA LIMA, DEPARTAMENTO LIMA";MUNICIPALIDAD DISTRITAL DE PACHACAMAC;522,000;844;16;;;
450;2492256;LIMA;"REPARACION DE CALZADA; EN EL(LA) PUEBLO JOVEN VILLA ALEJANDRO I, A.H. PROYECTO INTEGRAL VILLA ALEJANDRO II Y AMPLIACIÓN, Y A.H. PROGRAMA MUNICIPAL DE VIVIENDA VILLA ALEJANDRO III, ZONA E, DISTRITO DE LURIN, PROVINCIA LIMA, DEPARTAMENTO LIMA";MUNICIPALIDAD DISTRITAL DE LURIN;1,408,424;3,088;42;;;
451;2492300;LIMA;RENOVACION DE PISTAS EN EL (LA) AVENIDA FERROCARRIL DE ÑLA LOCALIDAD DE HUAURA, DISTRITO DE HUAURA, PROVINCIA DE HUAURA, DEPARTAMENTO LIMA;MUNICIPALIDAD DISTRITAL DE HUAURA;694,822;320;21;;;
452;2492307;LIMA;RENOVACION DE PISTAS EN EL (LA) AVENIDA SAN FRANCISCO  DE LA LOCALIDAD DE HUAURA, DISTRITO DE HUAURA, PROVINCIA DE HUAURA, DEPARTAMENTO LIMA;MUNICIPALIDAD DISTRITAL DE HUAURA;651,154;280;20;;;
453;2492319;LIMA;"RENOVACION DE PAVIMENTO Y VEREDA; REPARACION DE SARDINEL; CONSTRUCCION DE RAMPA; ADEMÁS DE OTROS ACTIVOS EN EL(LA) JR REAL, CERCADO DE MALA, EN LA LOCALIDAD MALA, DISTRITO DE MALA, PROVINCIA CAÑETE, DEPARTAMENTO LIMA";MUNICIPALIDAD DISTRITAL DE MALA;531,483;1,717;17;;;
454;2491706;LIMA;"RENOVACION DE PISTA, SARDINEL, VEREDA Y RAMPA; EN EL(LA) JR. AYACUCHO EN LA LOCALIDAD IMPERIAL, DISTRITO DE IMPERIAL, PROVINCIA CAÑETE, DEPARTAMENTO LIMA";MUNICIPALIDAD PROVINCIAL DE CAÑETE - SAN VICENTE DE CAÑETE;1,314,611;1,511;39;;;
455;2492455;LIMA;OPTIMIZACION DE LA VIA DE ACCESO AL CENTRO POBLADO SANTA ROSA DE MACAS, DISTRITO DE SANTA ROSA DE QUIVES - PROVINCIA DE CANTA - DEPARTAMENTO LIMA.;MUNICIPALIDAD DISTRITAL DE SANTA ROSA DE QUIVES;523,547;250;16;;;
456;2492242;LIMA;"REPARACION DE PAVIMENTO; EN EL(LA) CALZADA DE AVS: BELISARIO SUAREZ (TRAMO I: AV. PEDRO MIOTTA - AV. SAN JUAN Y TRAMO II: AV. CESAR CANEVARO- AV. TOMAS GUZMAN) Y JOSE MARIA SEGUIN (TRAMO AV. GUILLERMO BILLINGHURST- JR. MAXIMILIANO CARRANZA) ,ZONA URBANA, DISTRITO DE SAN JUAN DE MIRAFLORES, PROVINCIA LIMA, DEPARTAMENTO LIMA";MUNICIPALIDAD DISTRITAL DE SAN JUAN DE MIRAFLORES;684,290;480;21;;;
457;2491227;LIMA;"REPARACION DE PAVIMENTO; EN EL(LA) CALZADA DE AV. SOLIDARIDAD (TRAMO AV. DEFENSORES DE LIMA- AV. 5) Y AV. 5 (TRAMO AV. SOLIDARIDAD-AV. CENTRAL) ,ZONA PAMPLONA ALTA, DISTRITO DE SAN JUAN DE MIRAFLORES, PROVINCIA LIMA, DEPARTAMENTO LIMA";MUNICIPALIDAD DISTRITAL DE SAN JUAN DE MIRAFLORES;597,441;820;18;;;
458;2491230;LIMA;"REPARACION DE PAVIMENTO; EN EL(LA) CALZADA DE AV: LOS ALAMOS ,ZONA PANAMERICANA SUR, DISTRITO DE SAN JUAN DE MIRAFLORES, PROVINCIA LIMA, DEPARTAMENTO LIMA";MUNICIPALIDAD DISTRITAL DE SAN JUAN DE MIRAFLORES;597,505;360;18;;;
459;2491226;LIMA;"REPARACION DE PAVIMENTO; EN EL(LA) CALZADA DE AV LOS CONQUISTADORES (TRAMO AV. PEDRO MIOTTA- AV. S/N) Y AV. S/N (TRAMO AV. ALAMEDA  AV. VICTOR CASTRO IGLESIAS) ,ZONA PAMPAS DE SAN JUAN, DISTRITO DE SAN JUAN DE MIRAFLORES, PROVINCIA LIMA, DEPARTAMENTO LIMA";MUNICIPALIDAD DISTRITAL DE SAN JUAN DE MIRAFLORES;639,804;1,280;20;;;
460;2492355;LIMA;"CONSTRUCCION DE VEREDA, RAMPA Y SARDINEL; REPARACION DE PISTA; ADEMAS DE OTROS ACTIVOS EN EL (LA) URBANIZACION POPULAR ASOCIACION DE VIVIENDA SAN FRANCISO DE CAYRAN CALLES 10, 12, 24 Y 26 DEL DISTRITO DE SAN MARTIN DE PORRES, PROVINCIA LIMA, DEPARTAMENTO LIMA.";MUNICIPALIDAD DISTRITAL DE SAN MARTIN DE PORRES;759,646;160;23;;;
461;2492351;LIMA;" REPARACION  DE PISTA, VEREDA, SARDINEL Y RAMPA; EN EL (LA)AV. AUGUSTO B. LEGUIA Y  CUADRA 1 DE LA AV SAN MARTIN  DEL BARRIO MARGINAL COOPERATIVA POLICIAL DEL DISTRITO DE SAN MARTIN DE PORRES, PROVINCIA LIMA, DEPARTAMENTO LIMA.";MUNICIPALIDAD DISTRITAL DE SAN MARTIN DE PORRES;1,598,979;221;47;;;
462;2492362;LIMA;"REPARACION DE PISTA Y  CONSTRUCCION DE VEREDA; EN EL(LA) AV. CAMINO REAL TRAMO  AV. SANTO DOMINGO  AV. PRINCIPAL Y AV. A TRAMO AV. CAMINO REAL - AV. ""U""  DISTRITO DE CARABAYLLO, PROVINCIA LIMA, DEPARTAMENTO LIMA.";MUNICIPALIDAD DISTRITAL DE CARABAYLLO;1,788,477;555;52;;;
463;2492318;LIMA;"REPARACION DE PISTA EN LA ASOCIACIÓN DE VIVIENDA MILAGROSA CRUZ DE MOTUPE Y  EN LA ASOCIACIÓN DE VIVIENDA LAS ROSAS VIRGEN DEL CARMEN;  DISTRITO DE PUENTE PIEDRA, PROVINCIA LIMA, DEPARTAMENTO LIMA";MUNICIPALIDAD DISTRITAL DE PUENTE PIEDRA;1,206,636;789;36;;;
464;2492316;LIMA;"REPARACION DE PISTA; EN LA URBANIZACIÓN EL TARO;  DISTRITO DE PUENTE PIEDRA, PROVINCIA LIMA, DEPARTAMENTO LIMA";MUNICIPALIDAD DISTRITAL DE PUENTE PIEDRA;582,236;773;18;;;
465;2492310;LIMA;"REPARACION DE PISTA EN LA ASOCIACIÓN DE PROPIETARIOS DE VIVIENDA LA MERCED Y EN LA ASOCIACIÓN DE PROPIETARIOS DE VIVIENDA CHAVIN DE HUANTAR I ;  DISTRITO DE PUENTE PIEDRA, PROVINCIA LIMA, DEPARTAMENTO LIMA";MUNICIPALIDAD DISTRITAL DE PUENTE PIEDRA;780,101;797;23;;;
466;2492303;LIMA;"REPARACION DE PISTA EN LA ASOC. DE PROPIETARIOS DE LA URBANIZACIÓN CASUARINAS DEL NORTE,ASOC. DE VIVIENDA LAS BEGONIAS,ASOC. DE PROPIETARIOS TAMBO INGA Y ASOC. DE VIVIENDA LA CASTELLANA DEL NORTE;  DISTRITO DE PUENTE PIEDRA, PROVINCIA LIMA, DEPARTAMENTO LIMA";MUNICIPALIDAD DISTRITAL DE PUENTE PIEDRA;756,849;699;23;;;
467;2492393;LIMA;REPARACIÓN DE PISTA  EN LA CALLE 05, CALLE 18, CALLE 08, CALLE 17, CALLE 01, CALLE 16 Y CALLE 06 DE LA URBANIZACIÓN SAN JOSÉ, DISTRITO DE ANCÓN - PROVINCIA DE LIMA - DEPARTAMENTO DE LIMA;MUNICIPALIDAD DISTRITAL DE ANCON;534,787;299;17;;;
468;2492824;LIMA;"REPARACION DE PISTA; EN EL(LA) AV. HUAROCHIRI (TRAMO: OVALO MONUMENTAL - CALLE ARAGON), ZONA 02, SUB ZONA 03 DEL DISTRITO DE ATE, PROVINCIA LIMA, DEPARTAMENTO LIMA ";MUNICIPALIDAD DISTRITAL DE ATE - VITARTE;663,240;2,000;20;;;
469;2492836;LIMA;"REPARACION DE PISTA; EN EL(LA) URBANIZACIÓN SAN GREGORIO, ZONA 04, SUB ZONA 02 DEL DISTRITO DE ATE, PROVINCIA LIMA, DEPARTAMENTO LIMA";MUNICIPALIDAD DISTRITAL DE ATE - VITARTE;1,267,446;1,800;38;;;
470;2492832;LIMA;"REPARACION DE PISTA; EN EL(LA) AV. SAN MARTÍN (TRAMO: JR. HUANCHIHUAYLAS - PLAZA CÍVICA DE SANTA CLARA) Y JR. HUANCHIHUAYLAS (TRAMO: CARRETERA CENTRAL - JOSE CARLOS MARIATEGUI) DEL DISTRITO DE ATE, PROVINCIA LIMA, DEPARTAMENTO LIMA";MUNICIPALIDAD DISTRITAL DE ATE - VITARTE;974,531;1,600;29;;;
471;2492837;LIMA;"REPARACION DE PISTA; EN EL(LA) URBANIZACIÓN SANTA CLARA, ZONA 05, SUB ZONA 01 DEL DISTRITO DE ATE, PROVINCIA LIMA, DEPARTAMENTO LIMA ";MUNICIPALIDAD DISTRITAL DE ATE - VITARTE;763,962;1,000;23;;;
472;2025905;LIMA;CONSTRUCCION DE PISTAS Y VEREDAS EN LA COMUNIDAD AUTOGESTIONARIA DE HUAYCAN  ZONA A - II ETAPA;MUNICIPALIDAD DISTRITAL DE ATE - VITARTE;9,141,876;6,170;266;;;
473;2399565;LIMA;MEJORAMIENTO DEL SERVICIO DE TRANSITABILIDAD VEHICULAR  Y PEATONAL  DE LAS CALLES  INTERNAS DE LA ZONA 06 DEL ANEXO 08, DISTRITO DE SAN ANTONIO - PROVINCIA DE HUAROCHIRI - REGIÓN LIMA;MUNICIPALIDAD DISTRITAL DE SAN ANTONIO;27,990,059;3,045;812;;;
474;2410450;LIMA;MEJORAMIENTO DE LOS SERVICIOS DE TRANSITABILIDAD VEHICULAR Y PEATONAL  DE LAS CALLES INTERNAS  DE LA URB. MIGUEL GRAU Y LA URB. INGENIERIA 1RA Y 2DA ETAPA DE LA ZONA I,  DISTRITO DE SAN MARTIN DE PORRES - PROVINCIA DE LIMA - DEPARTAMENTO DE LIMA;MUNICIPALIDAD DISTRITAL DE SAN MARTIN DE PORRES;9,606,733;12,654;254;;;
475;2438844;LIMA;MEJORAMIENTO DE LOS SERVICIOS DE RECREACION Y ESPARCIMIENTO EN EL PARQUE CESAR VALLEJO DE LA URBANIZACION INGENIERIA I ETAPA DEL DISTRITO DE SAN MARTIN DE PORRES - PROVINCIA DE LIMA - DEPARTAMENTO DE LIMA;MUNICIPALIDAD DISTRITAL DE SAN MARTIN DE PORRES;644,203;1,148;20;;;
476;2331898;LORETO;MEJORAMIENTO E INSTALACION DEL SISTEMA DE ALCANTARILLADO DE AGUAS PLUVIALES EN EL AA.HH. VIRGEN DE LOURDES, DISTRITO DE SAN JUAN BAUTISTA - MAYNAS - LORETO;MUNICIPALIDAD DISTRITAL DE SAN JUAN BAUTISTA;4,684,058;3,229;34;;;
477;2310437;LORETO;MEJORAMIENTO, AMPLIACION DEL SERVICIO DE AGUA POTABLE Y PLANTA DE TRATAMIENTO DE AGUAS RESIDUALES EN LA LOCALIDAD DE SAN JOSE DE SARAMURO - RIO MARAÑÓN, DISTRITO DE URARINAS - LORETO - LORETO;MUNICIPALIDAD DISTRITAL DE URARINAS;13,977,016.57;2,156;152;;;
478;2235554;LORETO;INSTALACION DE LOS SISTEMAS DE AGUA POTABLE Y SANEAMIENTO PARA EL CENTRO POBLADO DE ATAHUALPA , DISTRITO DE MANSERICHE - DATEM DEL MARANON - LORETO;PROGRAMA NACIONAL DE SANEAMIENTO RURAL;7,140,357;585;133;;;
479;2431601;LORETO;"""Optimización de la Prestacion del Servicio de Agua Potable (Continuidad y Presión) para los Sectores Críticos en el Área de Influencia del R-1, R-3 y R-11 del Distrito de Belen, Punchana y San Juan- Provincia de Maynas-Dpto. de Loreto Etapa1";EPS SEDALORETO S.A;10,171,666;29,695;70;;;
480;2465769;LORETO;"""Mantenimiento de reservorio apoyado R-1 en el distrito de Iquitos, provincia de Maynas, región Loreto";EPS SEDALORETO S.A;450,839;140,112;25;;;
481;2465847;LORETO;"""Mantenimiento de la captación de agua en el distrito de Requena, provincia de Requena, región Loreto ";EPS SEDALORETO S.A;133,525;11,000;12;;;
482;2455771;LORETO;CREACION DE LA LOSA MULTIUSOS DE LA CALLE AMAZONAS EN LA CIUDAD DE CONTAMANA,  DISTRITO DE CONTAMANA - PROVINCIA DE UCAYALI - DEPARTAMENTO DE LORETO;MUNICIPALIDAD PROVINCIAL DE UCAYALI - CONTAMANA;724,134;2,019;22;;;
483;2332955;LORETO;AMPLIACION Y MEJORAMIENTO DE LAS PRINCIPALES CALLES DE LA LOCALIDAD DE ULLPAYACU, DISTRITO DE PASTAZA - DATEM DEL MARANON - LORETO;MUNICIPALIDAD DISTRITAL DE PASTAZA;8,983,380;2,829;261;;;
484;2492834;LORETO;"CONSTRUCCION DE PAVIMENTO Y VEREDA; REPARACION DE PAVIMENTO; EN EL(LA) ZONA DEL P.J. 09 DE OCTUBRE II ETAPA, DISTRITO DE IQUITOS, PROVINCIA MAYNAS, DEPARTAMENTO LORETO";MUNICIPALIDAD PROVINCIAL DE MAYNAS;1,857,101;250;55;;;
485;2492839;LORETO;"CONSTRUCCION DE PAVIMENTO Y VEREDA; REPARACION DE VEREDA; EN EL(LA) ZONA DEL A.H. TERRENOS MUNICIPALES, DISTRITO DE IQUITOS, PROVINCIA MAYNAS, DEPARTAMENTO LORETO";MUNICIPALIDAD PROVINCIAL DE MAYNAS;572,553;180;17;;;
486;2491949;LORETO;"REPARACION DE PAVIMENTO Y VEREDA; EN EL(LA) JIRON ABTAO CDRA 2 Y CDRA 3 DISTRITO DE BELEN, PROVINCIA MAYNAS, DEPARTAMENTO LORETO";MUNICIPALIDAD DISTRITAL DE BELEN;753,802;220;23;;;
487;2491889;LORETO;"REPARACION DE PAVIMENTO Y VEREDA; EN EL(LA) PASAJE MIRAFLORES (ENTRE LA AVENIDA PARTICIPACIÓN Y CA. SARAGOZA) DISTRITO DE BELEN, PROVINCIA MAYNAS, DEPARTAMENTO LORETO";MUNICIPALIDAD DISTRITAL DE BELEN;662,596;208;20;;;
488;2493087;LORETO;"CONSTRUCCION DE PAVIMENTO Y VEREDA; REPARACION DE PAVIMENTO; EN EL(LA) CALLE PROGRESO (ENTRE LA CALLE MIRAFLORES/CALLE SAPOSOA) DEL PP.JJ. 09 DE OCTUBRE III ETAPA DISTRITO DE BELEN, PROVINCIA MAYNAS, DEPARTAMENTO LORETO ";MUNICIPALIDAD DISTRITAL DE BELEN;504,404;275;16;;;
489;2491976;LORETO;"REPARACION DE PAVIMENTO; EN EL(LA) JR. PROSPERO (CINCO CUADRAS, ENTRE CA. SANTA ROSA Y JR. 9 DE DICIEMBRE) DISTRITO DE BELEN, PROVINCIA MAYNAS, DEPARTAMENTO LORETO";MUNICIPALIDAD DISTRITAL DE BELEN;667,366;243;20;;;
490;2491859;LORETO;"CONSTRUCCION DE VEREDA; SEÑALES DE TRÁFICO, AREA VERDE Y RAMPA; ADEMAS DE OTROS ACTIVOS EN EL (LA) CALLES DEL BARRIO ALIPIO PONCE EN LA LOCALIDAD DE ULLPAYACU, DISTRITO DE PASTAZA, PROVINCIA DATEM DEL MARAÑON, DEPARTAMENTO LORETO";MUNICIPALIDAD DISTRITAL DE PASTAZA;1,007,954;300;31;;;
491;2492112;LORETO;"CONSTRUCCION DE VEREDA; REPARACION DE VEREDA; EN EL (LA) CALLES SANTA ROSA, WITMAN Y LA PEDRERA PEBAS DISTRITO DE PEBAS, PROVINCIA MARISCAL RAMON CASTILLA, DEPARTAMENTO LORETO";MUNICIPALIDAD DISTRITAL DE PEBAS;705,293;250;22;;;
492;2492233;LORETO;"CONSTRUCCION DE PUENTE PEATONAL; EN EL(LA) CALLE SAN PEDRO Y CALLE SANTA TERESA EN LA LOCALIDAD ISLANDIA, DISTRITO DE YAVARI, PROVINCIA MARISCAL RAMON CASTILLA, DEPARTAMENTO LORETO";MUNICIPALIDAD DISTRITAL DE YAVARI;1,765,398;80;52;;;
493;2453990;LORETO;MEJORAMIENTO DEL ACCESO VIAL AL MERCADO MUNICIPAL (CALLES ADYACENTES) DE TAMSHIYACU DEL DISTRITO DE FERNANDO LORES - PROVINCIA DE MAYNAS - DEPARTAMENTO DE LORETO;MUNICIPALIDAD DISTRITAL DE FERNANDO LORES;7,215,778;1,356;211;;;
494;2431973;MOQUEGUA;CREACION DE LOS SERVICIOS DE DRENAJE PLUVIAL EN LA QUEBRADA PRINCIPAL Y PASAJE NUMERO TRES DE LA LOCALIDAD LA CAPILLA  DISTRITO DE LA CAPILLA - PROVINCIA DE GENERAL SANCHEZ CERRO - DEPARTAMENTO DE MOQUEGUA;MUNICIPALIDAD DISTRITAL DE LA CAPILLA;3,577,020;3,396;29;;;
495;2276837;MOQUEGUA;INSTALACION DE LAS REDES DE AGUA POTABLE, ALCANTARILLADO Y CONEXIONES DOMICILIARIAS DEL PROGRAMA MUNICIPAL DE VIVIENDA PROMUVI I DEL DISTRITO EL ALGARROBAL, PROVINCIA DE ILO, REGION MOQUEGUA;MUNICIPALIDAD DISTRITAL DE EL ALGARROBAL;16,824,488;6,603;60;;;
496;2445303;MOQUEGUA;"ADQUISICION DE MICROMEDIDORES; EN EL(LA) EPS ILO SA EN LA LOCALIDAD ILO, DISTRITO DE ILO, PROVINCIA ILO, DEPARTAMENTO MOQUEGUA";EPS ILO S.A.;2,434,319;55,968;60;;;
